{"agtp_version": "v0.0.6", "agent_id": "aaaaaaaaaaaaaaaaaaaaaaaaaaaaaaaaaaaaaaaaaaaaaaaaaaaaaaaaaaaaaaaa", "name": "x", "principal": "p", "principal_id": "p", "description": "", "status": "active", "skills": [], "requires": {"methods": ["REVOKE"], "scopes": [], "wildcards": false}, "scopes_accepted": [], "issued_at": "now", "issuer": "self"}