{"agtp_version": "v0.0.6", "agent_id": "f42733aac60697fcdfbb3867cb73c773fcf7d3cc151cebe8fd40a36352ef981a", "name": "lauren", "principal": "c", "principal_id": "c", "description": "", "status": "active", "skills": [], "requires": {"methods": ["INSPECT", "DESCRIBE"], "scopes": [], "wildcards": false}, "scopes_accepted": [], "issued_at": "now", "issuer": "self"}