{"agtp_version": "v0.0.6", "agent_id": "94a183dc071eae41b6e07ca405d49f1f61ff4dfdc83a5adfc6721bc446a3c342", "name": "lauren", "principal": "c", "principal_id": "c", "description": "", "status": "active", "skills": [], "requires": {"methods": ["INSPECT", "DESCRIBE"], "scopes": [], "wildcards": false}, "scopes_accepted": [], "issued_at": "now", "issuer": "self"}