{"agtp_version": "v0.0.6", "agent_id": "34105877f30c91c75b253db164187bae9fbbe302c156b636006a7d1cc2316534", "name": "lauren", "principal": "c", "principal_id": "c", "description": "", "status": "active", "skills": [], "requires": {"methods": ["ACTIVATE", "DEACTIVATE", "REVOKE", "INSPECT"], "scopes": [], "wildcards": false}, "scopes_accepted": [], "issued_at": "now", "issuer": "self"}