{"agtp_version": "v0.0.6", "agent_id": "58504e92f72fdd9b4b6ba6c49fad2c003080587142221c135b0b819593407302", "name": "lauren", "principal": "c", "principal_id": "c", "description": "", "status": "active", "skills": [], "requires": {"methods": ["ACTIVATE", "DEACTIVATE", "REVOKE", "INSPECT"], "scopes": [], "wildcards": false}, "scopes_accepted": [], "issued_at": "now", "issuer": "self"}