{"agtp_version": "v0.0.6", "agent_id": "747f00d32a720ae094d975e21c1059160e96802538bf785b1d109cc5afb28d7b", "name": "lauren", "principal": "c", "principal_id": "c", "description": "", "status": "active", "skills": [], "requires": {"methods": ["ACTIVATE", "DEACTIVATE", "REVOKE", "INSPECT"], "scopes": [], "wildcards": false}, "scopes_accepted": [], "issued_at": "now", "issuer": "self"}