{"agtp_version": "v0.0.6", "agent_id": "c557263e9b25a8ef0b9a525615911a808bdf0e2395d7c5a6e3df70f3ba9f2080", "name": "lauren", "principal": "c", "principal_id": "c", "description": "", "status": "active", "skills": [], "requires": {"methods": ["INSPECT", "DESCRIBE"], "scopes": [], "wildcards": false}, "scopes_accepted": [], "issued_at": "now", "issuer": "self"}